{
  "$id": "radjax_tome_payload_layout_v2",
  "$schema": "https://json-schema.org/draft/2020-12/schema",
  "additionalProperties": false,
  "properties": {
    "payload_index_ref": {
      "$id": "radjax_tome_index_reference_v1",
      "$schema": "https://json-schema.org/draft/2020-12/schema",
      "additionalProperties": false,
      "properties": {
        "path": {
          "minLength": 1,
          "pattern": "^[A-Za-z0-9][A-Za-z0-9._/-]*$",
          "type": "string"
        },
        "record_count": {
          "maximum": 9223372036854775807,
          "minimum": 0,
          "type": "integer"
        },
        "schema_version": {
          "minLength": 1,
          "pattern": "^[^\\x00\\r\\n]+$",
          "type": "string"
        },
        "sha256": {
          "pattern": "^sha256:[0-9a-f]{64}$",
          "type": "string"
        },
        "size_bytes": {
          "maximum": 9223372036854775807,
          "minimum": 0,
          "type": "integer"
        }
      },
      "required": [
        "path",
        "sha256",
        "size_bytes",
        "schema_version",
        "record_count"
      ],
      "type": "object"
    },
    "record_count": {
      "maximum": 9223372036854775807,
      "minimum": 0,
      "type": "integer"
    },
    "schema_version": {
      "const": "radjax_tome_payload_layout_v2"
    },
    "semantic_identity_ref": {
      "$id": "radjax_tome_reference_v1",
      "$schema": "https://json-schema.org/draft/2020-12/schema",
      "additionalProperties": false,
      "properties": {
        "path": {
          "minLength": 1,
          "pattern": "^[A-Za-z0-9][A-Za-z0-9._/-]*$",
          "type": "string"
        },
        "schema_version": {
          "minLength": 1,
          "pattern": "^[^\\x00\\r\\n]+$",
          "type": "string"
        },
        "sha256": {
          "pattern": "^sha256:[0-9a-f]{64}$",
          "type": "string"
        },
        "size_bytes": {
          "maximum": 9223372036854775807,
          "minimum": 0,
          "type": "integer"
        }
      },
      "required": [
        "path",
        "sha256",
        "size_bytes",
        "schema_version"
      ],
      "type": "object"
    },
    "shard_capacity": {
      "maximum": 9223372036854775807,
      "minimum": 1,
      "type": "integer"
    },
    "shard_index_ref": {
      "$id": "radjax_tome_index_reference_v1",
      "$schema": "https://json-schema.org/draft/2020-12/schema",
      "additionalProperties": false,
      "properties": {
        "path": {
          "minLength": 1,
          "pattern": "^[A-Za-z0-9][A-Za-z0-9._/-]*$",
          "type": "string"
        },
        "record_count": {
          "maximum": 9223372036854775807,
          "minimum": 0,
          "type": "integer"
        },
        "schema_version": {
          "minLength": 1,
          "pattern": "^[^\\x00\\r\\n]+$",
          "type": "string"
        },
        "sha256": {
          "pattern": "^sha256:[0-9a-f]{64}$",
          "type": "string"
        },
        "size_bytes": {
          "maximum": 9223372036854775807,
          "minimum": 0,
          "type": "integer"
        }
      },
      "required": [
        "path",
        "sha256",
        "size_bytes",
        "schema_version",
        "record_count"
      ],
      "type": "object"
    }
  },
  "required": [
    "schema_version",
    "semantic_identity_ref",
    "payload_index_ref",
    "shard_index_ref",
    "record_count",
    "shard_capacity"
  ],
  "type": "object"
}
