{"payload_index_ref":{"path":"selected_exemplars/payload-index.jsonl","record_count":4,"schema_version":"radjax_tome_payload_index_v3","sha256":"sha256:5541a4a55f4dbe4ef67e9e472516f972f77c8ee1451c18c75a400ff25a22d87d","size_bytes":548},"record_count":4,"schema_version":"radjax_tome_payload_layout_v2","semantic_identity_ref":{"path":"provenance/semantic-identity.json","schema_version":"radjax_tome_semantic_identity_v3","sha256":"sha256:813a6aeb11ea6dd7cda59f52c0a70a8e340527c55f73e6bc3cd18989fffb5c3b","size_bytes":593},"shard_capacity":2,"shard_index_ref":{"path":"selected_exemplars/payload-shards.jsonl","record_count":2,"schema_version":"radjax_tome_payload_shard_index_v2","sha256":"sha256:a54b2f5f14c7cb8b58d323424251a8631251ef21413880ee600eea00f6da1b9d","size_bytes":424}}